{
  "schema_version": "1.0.0",
  "project": "Ashante MVP",
  "authority": "google-control-plane",
  "mirror": "github-public-telemetry",
  "generated_at": "2026-09-04T11:24:06Z",
  "source_modified_at": "2026-09-04T11:20:36.858Z",
  "mirror_status": "CURRENT",
  "state_vocabulary": [
    "NOT_STARTED",
    "READY",
    "ACTIVE",
    "BUILT_WAITING_VERIFICATION",
    "PASS",
    "REWORK",
    "BLOCKED",
    "WAIT_DEP",
    "STATE_UNAVAILABLE"
  ],
  "tasks": [
    {"task_id":"A01","label":"Baseline repo health check + build/typecheck snapshot","lane":"Repo/Foundation","priority":"P0","state":"BUILT_WAITING_VERIFICATION","build_state":"BUILT","verification_state":"NOT_RUN","dependencies":[],"builder":"GPT Work — User","verifier":"Anti-Gravity","retry_count":0,"claimed_by":null,"next_action":"Independently verify A01 baseline receipt; do not treat BUILT as PASS"},
    {"task_id":"A02","label":"Freeze MVP scope + authoritative contract pointers","lane":"Repo/Foundation","priority":"P0","state":"PASS","build_state":"BUILT","verification_state":"PASS","dependencies":[],"builder":"GPT Work — User","verifier":"Anti-Gravity","retry_count":0,"claimed_by":"Gemini Spark","next_action":"PASS — MVP scope frozen and authority pointers verified"},
    {"task_id":"A03","label":"Validate canonical SQLite schema against current implementation","lane":"Data Spine","priority":"P0","state":"WAIT_DEP","build_state":"WAIT_DEP","verification_state":"NOT_RUN","dependencies":["A01"],"builder":"GPT Work — User","verifier":"Anti-Gravity","retry_count":0,"claimed_by":null,"next_action":"Verify when BUILT and A01 PASS"},
    {"task_id":"A04","label":"Validate Zod validators against canonical TS contract","lane":"Data Spine","priority":"P0","state":"WAIT_DEP","build_state":"WAIT_DEP","verification_state":"NOT_RUN","dependencies":["A01"],"builder":"GPT Work — Ashante","verifier":"Anti-Gravity","retry_count":0,"claimed_by":null,"next_action":"Verify when BUILT and A01 PASS"},
    {"task_id":"A05","label":"Create Property Fixture #1","lane":"Fixtures","priority":"P1","state":"REWORK","build_state":"BUILT","verification_state":"FAIL","dependencies":[],"builder":"GPT Work — Ashante","verifier":"Anti-Gravity","retry_count":1,"claimed_by":null,"next_action":"Contract mismatch on occupancy_status, auction_status, and envelope schema; routed to rework"},
    {"task_id":"A06","label":"Create Property Fixture #2 with missing-data profile","lane":"Fixtures","priority":"P1","state":"READY","build_state":"READY","verification_state":"NOT_RUN","dependencies":[],"builder":"Cheap/Secondary Agent","verifier":"Anti-Gravity","retry_count":0,"claimed_by":null,"next_action":"Verify independently after build"},
    {"task_id":"B01","label":"Confirm shortlist data model + selection contract","lane":"Desktop Shortlist","priority":"P0","state":"WAIT_DEP","build_state":"WAIT_DEP","verification_state":"NOT_RUN","dependencies":["A03","A04"],"builder":"GPT Work — User","verifier":"Anti-Gravity","retry_count":0,"claimed_by":null,"next_action":"Verify after hard deps PASS"},
    {"task_id":"B02","label":"Wire shortlist selection to property-envelope assembler","lane":"Desktop Shortlist","priority":"P0","state":"WAIT_DEP","build_state":"WAIT_DEP","verification_state":"NOT_RUN","dependencies":["B01","A05"],"builder":"GPT Work — User","verifier":"Anti-Gravity","retry_count":0,"claimed_by":null,"next_action":"Verify after hard deps PASS"},
    {"task_id":"C01","label":"Implement/repair property-envelope assembly","lane":"Property Envelope","priority":"P0","state":"WAIT_DEP","build_state":"WAIT_DEP","verification_state":"NOT_RUN","dependencies":["A03","A04","A05"],"builder":"GPT Work — Ashante","verifier":"Anti-Gravity","retry_count":0,"claimed_by":null,"next_action":"Verify after hard deps PASS"},
    {"task_id":"C02","label":"Define mobile-critical field ordering + must-see auction view","lane":"Property Envelope","priority":"P1","state":"PASS","build_state":"BUILT","verification_state":"PASS","dependencies":[],"builder":"GPT Work — Ashante","verifier":"Anti-Gravity","retry_count":0,"claimed_by":"Gemini Spark","next_action":"PASS — mobile-critical field ordering verified"},
    {"task_id":"C03","label":"Missing-data badge/elapsed-unavailable behavior","lane":"Property Envelope","priority":"P1","state":"WAIT_DEP","build_state":"WAIT_DEP","verification_state":"NOT_RUN","dependencies":["A04"],"builder":"GPT Work — Ashante","verifier":"Anti-Gravity","retry_count":0,"claimed_by":null,"next_action":"Verify after A04 PASS"},
    {"task_id":"D01","label":"Build self-contained single-file HTML exporter","lane":"Export","priority":"P0","state":"WAIT_DEP","build_state":"WAIT_DEP","verification_state":"NOT_RUN","dependencies":["C01"],"builder":"GPT Work — User","verifier":"Anti-Gravity","retry_count":0,"claimed_by":null,"next_action":"Verify exporter output"},
    {"task_id":"D02","label":"Bind mobile field ordering into HTML template","lane":"Export","priority":"P0","state":"WAIT_DEP","build_state":"WAIT_DEP","verification_state":"NOT_RUN","dependencies":["C02","D01"],"builder":"GPT Work — Ashante","verifier":"Anti-Gravity","retry_count":0,"claimed_by":null,"next_action":"Verify mobile field binding"},
    {"task_id":"D03","label":"Package assets so export has no broken external dependencies","lane":"Export","priority":"P1","state":"READY","build_state":"READY","verification_state":"NOT_RUN","dependencies":[],"builder":"Anti-Gravity","verifier":"Anti-Gravity","retry_count":0,"claimed_by":null,"next_action":"Verify asset self-containment"},
    {"task_id":"E01","label":"Open/read exported HTML on target phone path","lane":"Mobile","priority":"P0","state":"WAIT_DEP","build_state":"WAIT_DEP","verification_state":"NOT_RUN","dependencies":["D01","D02","D03"],"builder":"GPT Work — Ashante","verifier":"Anti-Gravity","retry_count":0,"claimed_by":null,"next_action":"Verify target phone-open path"},
    {"task_id":"E02","label":"Offline/reopen behavior smoke test","lane":"Mobile","priority":"P0","state":"WAIT_DEP","build_state":"WAIT_DEP","verification_state":"NOT_RUN","dependencies":["E01"],"builder":"GPT Work — Ashante","verifier":"Anti-Gravity","retry_count":0,"claimed_by":null,"next_action":"Verify offline reopen"},
    {"task_id":"F01","label":"Persist shortlist + selected property state","lane":"Persistence","priority":"P1","state":"WAIT_DEP","build_state":"WAIT_DEP","verification_state":"NOT_RUN","dependencies":["A03"],"builder":"GPT Work — User","verifier":"Anti-Gravity","retry_count":0,"claimed_by":null,"next_action":"Verify restart/reopen persistence"},
    {"task_id":"F02","label":"Ensure export can be regenerated from persisted state","lane":"Persistence","priority":"P1","state":"WAIT_DEP","build_state":"WAIT_DEP","verification_state":"NOT_RUN","dependencies":["F01","C01"],"builder":"GPT Work — User","verifier":"Anti-Gravity","retry_count":0,"claimed_by":null,"next_action":"Verify export regeneration"},
    {"task_id":"G01","label":"Run Fixture #2 through shortlist → envelope","lane":"Second Property","priority":"P0","state":"WAIT_DEP","build_state":"WAIT_DEP","verification_state":"NOT_RUN","dependencies":["B02","C01","A06"],"builder":"GPT Work — Ashante","verifier":"Anti-Gravity","retry_count":0,"claimed_by":null,"next_action":"Verify no bespoke code changes"},
    {"task_id":"G02","label":"Export/open Fixture #2 on mobile","lane":"Second Property","priority":"P0","state":"WAIT_DEP","build_state":"WAIT_DEP","verification_state":"NOT_RUN","dependencies":["G01","D02","D03"],"builder":"GPT Work — Ashante","verifier":"Anti-Gravity","retry_count":0,"claimed_by":null,"next_action":"Verify second mobile export"},
    {"task_id":"H01","label":"Confirm Vercel-ready build path / env assumptions","lane":"Deployment","priority":"P1","state":"WAIT_DEP","build_state":"WAIT_DEP","verification_state":"NOT_RUN","dependencies":["A01"],"builder":"Anti-Gravity","verifier":"Anti-Gravity","retry_count":0,"claimed_by":null,"next_action":"Verify Vercel/build assumptions"},
    {"task_id":"H02","label":"Deploy or produce BLOCKED-HUMAN deployment packet","lane":"Deployment","priority":"P1","state":"WAIT_DEP","build_state":"WAIT_DEP","verification_state":"NOT_RUN","dependencies":["H01","E02","G02"],"builder":"GPT Work — User","verifier":"Anti-Gravity","retry_count":0,"claimed_by":null,"next_action":"Verify deploy or BLOCKED-HUMAN packet"},
    {"task_id":"I01","label":"Create concise runbook: build, test, export, mobile-open","lane":"Docs/Ops","priority":"P2","state":"READY","build_state":"READY","verification_state":"NOT_RUN","dependencies":[],"builder":"Cheap/Secondary Agent","verifier":"Anti-Gravity","retry_count":0,"claimed_by":null,"next_action":"Verify runbook reproducibility"},
    {"task_id":"I02","label":"Create deferred-scope backlog","lane":"Docs/Ops","priority":"P2","state":"PASS","build_state":"BUILT","verification_state":"PASS","dependencies":[],"builder":"GPT Work — Ashante","verifier":"Anti-Gravity","retry_count":0,"claimed_by":"Gemini Spark","next_action":"PASS — deferred-scope backlog verified outside active build"},
    {"task_id":"J01","label":"End-to-end acceptance: Fixture #1","lane":"Final Acceptance","priority":"P0","state":"WAIT_DEP","build_state":"WAIT_DEP","verification_state":"NOT_RUN","dependencies":["B02","C01","D02","D03","E02"],"builder":"Anti-Gravity","verifier":"Anti-Gravity","retry_count":0,"claimed_by":null,"next_action":"Run end-to-end fixture #1"},
    {"task_id":"J02","label":"End-to-end acceptance: Fixture #2","lane":"Final Acceptance","priority":"P0","state":"WAIT_DEP","build_state":"WAIT_DEP","verification_state":"NOT_RUN","dependencies":["G02","F02"],"builder":"Anti-Gravity","verifier":"Anti-Gravity","retry_count":0,"claimed_by":null,"next_action":"Run end-to-end fixture #2"},